{
 "cases": [
  {
   "a_id": "00013f25-4f52-40e8-bb72-e15b84a5fdc7",
   "case_id": "00013f25-4f52-40e8-bb72-e15b84a5fdc7",
   "comparison": {
    "agreement_class": "all_exported_agree",
    "distinct_chosen_b_ids": 1,
    "methods_exported": 2,
    "note": "The 2 exporting methods chose the same B (14127); tiers auto_accept, review. Agreement on the B id says nothing about within-method ambiguity: see each row's top2_gap and tier."
   },
   "evidence": [
    {
     "exported": false,
     "method_version": "exact_v1",
     "reason": "rejected",
     "source": "artifacts/mapping/mapping_exact_v1.test.csv.gz",
     "state": "not_exported"
    },
    {
     "ambiguity_demoted_derived": null,
     "b_id": "14127",
     "block_keys": [
      "k_phonetic",
      "k_title3",
      "k_title_sorted"
     ],
     "decided_at_utc": "2026-09-23T14:16:02+00:00",
     "exported": true,
     "gap_at_rounded_boundary": false,
     "gap_state": "single_candidate",
     "method_version": "rules_v1",
     "probability": 0.8,
     "run_id": "20260923T140606+0000",
     "score": 0.8,
     "source": "artifacts/mapping/mapping_rules_v1.test.csv.gz",
     "tier": "auto_accept",
     "top2_gap": null
    },
    {
     "ambiguity_demoted_derived": null,
     "b_id": "14127",
     "block_keys": [
      "k_phonetic",
      "k_title3",
      "k_title_sorted"
     ],
     "decided_at_utc": "2026-09-23T14:16:02+00:00",
     "exported": true,
     "gap_at_rounded_boundary": false,
     "gap_state": "single_candidate",
     "method_version": "learned_v1",
     "probability": 0.641571,
     "run_id": "20260923T140606+0000",
     "score": 0.970821,
     "source": "artifacts/mapping/mapping_learned_v1.test.csv.gz",
     "tier": "review",
     "top2_gap": null
    }
   ],
   "labels": {
    "labelled": true,
    "n_candidates_full": 1,
    "per_method": {
     "exact_v1": {
      "chosen_correct": null,
      "unrounded_ambiguous": null,
      "unrounded_gap": null
     },
     "learned_v1": {
      "chosen_correct": true,
      "note": "no unrounded learned scores exist",
      "unrounded_ambiguous": null,
      "unrounded_gap": null
     },
     "rules_v1": {
      "chosen_correct": true,
      "unrounded_ambiguous": null,
      "unrounded_gap": null
     }
    },
    "state": "verified_local",
    "truth_b_ids": [
     "14127"
    ],
    "truth_reachable_full": true,
    "truth_visible_in_exported_choices": true,
    "verifier": "entity_resolution.decision_lab.local_evidence@4a4e3d4e3cddb187fdeba4a7261ef5ab8a5369cc"
   },
   "narrative": null,
   "reason_codes": [
    "partial_export",
    "single_candidate"
   ]
  },
  {
   "a_id": "0001942d-bad7-438e-83b9-3781e3199746",
   "case_id": "0001942d-bad7-438e-83b9-3781e3199746",
   "comparison": {
    "agreement_class": "all_exported_agree",
    "distinct_chosen_b_ids": 1,
    "methods_exported": 3,
    "note": "The 3 exporting methods chose the same B (267052); tiers auto_accept. Agreement on the B id says nothing about within-method ambiguity: see each row's top2_gap and tier."
   },
   "evidence": [
    {
     "ambiguity_demoted_derived": false,
     "b_id": "267052",
     "block_keys": [
      "k_artist_year",
      "k_phonetic",
      "k_self_titled",
      "k_title3",
      "k_title_sorted"
     ],
     "decided_at_utc": "2026-09-23T14:16:02+00:00",
     "exported": true,
     "gap_at_rounded_boundary": false,
     "gap_state": "exported",
     "method_version": "exact_v1",
     "probability": 1.0,
     "run_id": "20260923T140606+0000",
     "score": 1.0,
     "source": "artifacts/mapping/mapping_exact_v1.test.csv.gz",
     "tier": "auto_accept",
     "top2_gap": 1.0
    },
    {
     "ambiguity_demoted_derived": false,
     "b_id": "267052",
     "block_keys": [
      "k_artist_year",
      "k_phonetic",
      "k_self_titled",
      "k_title3",
      "k_title_sorted"
     ],
     "decided_at_utc": "2026-09-23T14:16:02+00:00",
     "exported": true,
     "gap_at_rounded_boundary": false,
     "gap_state": "exported",
     "method_version": "rules_v1",
     "probability": 1.0,
     "run_id": "20260923T140606+0000",
     "score": 1.0,
     "source": "artifacts/mapping/mapping_rules_v1.test.csv.gz",
     "tier": "auto_accept",
     "top2_gap": 0.371429
    },
    {
     "ambiguity_demoted_derived": false,
     "b_id": "267052",
     "block_keys": [
      "k_artist_year",
      "k_phonetic",
      "k_self_titled",
      "k_title3",
      "k_title_sorted"
     ],
     "decided_at_utc": "2026-09-23T14:16:02+00:00",
     "exported": true,
     "gap_at_rounded_boundary": false,
     "gap_state": "exported",
     "method_version": "learned_v1",
     "probability": 0.995415,
     "run_id": "20260923T140606+0000",
     "score": 0.999557,
     "source": "artifacts/mapping/mapping_learned_v1.test.csv.gz",
     "tier": "auto_accept",
     "top2_gap": 0.994299
    }
   ],
   "labels": {
    "labelled": true,
    "n_candidates_full": 9,
    "per_method": {
     "exact_v1": {
      "chosen_correct": true,
      "unrounded_ambiguous": false,
      "unrounded_gap": 1.0
     },
     "learned_v1": {
      "chosen_correct": true,
      "note": "no unrounded learned scores exist",
      "unrounded_ambiguous": null,
      "unrounded_gap": null
     },
     "rules_v1": {
      "chosen_correct": true,
      "unrounded_ambiguous": false,
      "unrounded_gap": 0.37142858886718755
     }
    },
    "state": "verified_local",
    "truth_b_ids": [
     "267052"
    ],
    "truth_reachable_full": true,
    "truth_visible_in_exported_choices": true,
    "verifier": "entity_resolution.decision_lab.local_evidence@4a4e3d4e3cddb187fdeba4a7261ef5ab8a5369cc"
   },
   "narrative": null,
   "reason_codes": [
    "agreement_all_accept"
   ]
  },
  {
   "a_id": "0002dac9-ce9d-35ce-86f8-64634ef4caae",
   "case_id": "0002dac9-ce9d-35ce-86f8-64634ef4caae",
   "comparison": {
    "agreement_class": "all_exported_agree",
    "distinct_chosen_b_ids": 1,
    "methods_exported": 3,
    "note": "The 3 exporting methods chose the same B (665770); tiers auto_accept. Agreement on the B id says nothing about within-method ambiguity: see each row's top2_gap and tier."
   },
   "evidence": [
    {
     "ambiguity_demoted_derived": false,
     "b_id": "665770",
     "block_keys": [
      "k_artist_year",
      "k_phonetic",
      "k_title3",
      "k_title_sorted"
     ],
     "decided_at_utc": "2026-09-23T14:16:02+00:00",
     "exported": true,
     "gap_at_rounded_boundary": false,
     "gap_state": "exported",
     "method_version": "exact_v1",
     "probability": 1.0,
     "run_id": "20260923T140606+0000",
     "score": 1.0,
     "source": "artifacts/mapping/mapping_exact_v1.test.csv.gz",
     "tier": "auto_accept",
     "top2_gap": 1.0
    },
    {
     "ambiguity_demoted_derived": false,
     "b_id": "665770",
     "block_keys": [
      "k_artist_year",
      "k_phonetic",
      "k_title3",
      "k_title_sorted"
     ],
     "decided_at_utc": "2026-09-23T14:16:02+00:00",
     "exported": true,
     "gap_at_rounded_boundary": false,
     "gap_state": "exported",
     "method_version": "rules_v1",
     "probability": 1.0,
     "run_id": "20260923T140606+0000",
     "score": 1.0,
     "source": "artifacts/mapping/mapping_rules_v1.test.csv.gz",
     "tier": "auto_accept",
     "top2_gap": 0.2
    },
    {
     "ambiguity_demoted_derived": false,
     "b_id": "665770",
     "block_keys": [
      "k_artist_year",
      "k_phonetic",
      "k_title3",
      "k_title_sorted"
     ],
     "decided_at_utc": "2026-09-23T14:16:02+00:00",
     "exported": true,
     "gap_at_rounded_boundary": false,
     "gap_state": "exported",
     "method_version": "learned_v1",
     "probability": 0.995415,
     "run_id": "20260923T140606+0000",
     "score": 0.999736,
     "source": "artifacts/mapping/mapping_learned_v1.test.csv.gz",
     "tier": "auto_accept",
     "top2_gap": 0.969945
    }
   ],
   "labels": {
    "labelled": true,
    "n_candidates_full": 13,
    "per_method": {
     "exact_v1": {
      "chosen_correct": true,
      "unrounded_ambiguous": false,
      "unrounded_gap": 1.0
     },
     "learned_v1": {
      "chosen_correct": true,
      "note": "no unrounded learned scores exist",
      "unrounded_ambiguous": null,
      "unrounded_gap": null
     },
     "rules_v1": {
      "chosen_correct": true,
      "unrounded_ambiguous": false,
      "unrounded_gap": 0.19999999999999996
     }
    },
    "state": "verified_local",
    "truth_b_ids": [
     "665770"
    ],
    "truth_reachable_full": true,
    "truth_visible_in_exported_choices": true,
    "verifier": "entity_resolution.decision_lab.local_evidence@4a4e3d4e3cddb187fdeba4a7261ef5ab8a5369cc"
   },
   "narrative": null,
   "reason_codes": [
    "agreement_all_accept"
   ]
  },
  {
   "a_id": "0002f32f-e125-3453-9277-fdbb647b4967",
   "case_id": "0002f32f-e125-3453-9277-fdbb647b4967",
   "comparison": {
    "agreement_class": "none_exported",
    "distinct_chosen_b_ids": 0,
    "methods_exported": 0,
    "note": "No method exported this record: rejected by every method or no blocked candidate."
   },
   "evidence": [
    {
     "exported": false,
     "method_version": "exact_v1",
     "reason": "no_candidate",
     "source": "artifacts/mapping/mapping_exact_v1.test.csv.gz",
     "state": "not_exported"
    },
    {
     "exported": false,
     "method_version": "rules_v1",
     "reason": "no_candidate",
     "source": "artifacts/mapping/mapping_rules_v1.test.csv.gz",
     "state": "not_exported"
    },
    {
     "exported": false,
     "method_version": "learned_v1",
     "reason": "no_candidate",
     "source": "artifacts/mapping/mapping_learned_v1.test.csv.gz",
     "state": "not_exported"
    }
   ],
   "labels": {
    "labelled": false,
    "n_candidates_full": 0,
    "per_method": {
     "exact_v1": {
      "chosen_correct": null,
      "unrounded_ambiguous": null,
      "unrounded_gap": null
     },
     "learned_v1": {
      "chosen_correct": null,